{
  "chunk_id": "ch-005",
  "snapshot_id": "snap-53d0c1790348",
  "ranges": [
    [
      0,
      212
    ]
  ],
  "text": "In our survey of 412 parcel couriers in Berlin, 63% reported that they regularly cannot find a legal place to stop for deliveries. Couriers described double parking as the only way to meet their delivery targets.",
  "token_count": 53,
  "split": "main",
  "sub_area": "logistics_delivery",
  "source_type": "paper",
  "region": "DACH",
  "country": "DE",
  "language": "en",
  "date": "2026-01-15",
  "license": "CC-BY-4.0",
  "relevance_intent": "relevant",
  "redaction": {
    "patterns_version": "redact-v1",
    "manual_review_at": "2026-09-26T10:00:00+00:00",
    "check_passed": true
  }
}
